{
  "schemaVersion": 1,
  "iterationId": "GAP-0002-I01",
  "taskId": "GAP-0002",
  "iteration": 1,
  "loop": "GAP_CLOSURE",
  "sourceSha": "eab7d8f0d366f7a5ae25f430ddb195d37c5c2270",
  "hypothesis": {
    "statement": "Removing the 'Apply deterministic source repairs' step (mobile-source-sync, openapi-generation, dependency-deduplication, eslint-autofix, go-mod-tidy loop, gofmt) from remediation-analysis.yml, renaming it to BThwani Manual Patch Verification, and updating every guard/test/registry/doc marker that names the old workflow text will close GAP-0002 without breaking any of the three consuming guards.",
    "evidence": [
      ".github/workflows/remediation-analysis.yml",
      "tools/guards/required-command-integrity-gate.mjs",
      "tools/guards/guard-registry-gate.mjs",
      "tools/scripts/check-ci-source-immutability.mjs",
      "tools/scripts/check-ci-source-immutability.test.mjs",
      "governance/github/workflow-registry.json"
    ],
    "hash": "sha256:99d95996b98d5d7f0d557c37f6f328643c8b775379e5002e22b7667af0fa12c6",
    "failureFingerprint": "WORKFLOW_MODERNIZATION_REQUIRED:remediation-analysis.yml"
  },
  "plan": {
    "planHash": "sha256:52f896edb0a04a3224b442238bb3e1e02b9a3663c1d0627947565bd2583329e8",
    "intendedChanges": [
      "Remove the whole 'Apply deterministic source repairs' step from remediation-analysis.yml.",
      "Rename the workflow to 'BThwani Manual Patch Verification' and its job to 'Verify candidate source without auto-repair'.",
      "Rename repair-status.tsv to cleanup-status.tsv since only the policy-governed records cleanup remains.",
      "Update required-command-integrity-gate.mjs and check-ci-source-immutability.mjs marker checks to match the new name/job title.",
      "Remove the now-unneeded SOURCE_FORMAT_WRITE remediation exception in check-ci-source-immutability.mjs since no source-rewriting formatter remains in the workflow.",
      "Update check-ci-source-immutability.test.mjs's validRemediation fixture to match.",
      "Update workflow-registry.json's remediation-analysis entry name and purpose, and docs/ci-governance-required-checks.md's PRIVILEGED description.",
      "Review governance/cleanup/repository-retention-policy.json and governance/github/remediation-branch-return-policy.json for required changes; both reference the workflow only by file path, not by name/marker text, so neither needed edits."
    ],
    "expectedOutcomes": [
      "node tools/guards/required-command-integrity-gate.mjs exits 0",
      "node tools/guards/guard-registry-gate.mjs exits 0",
      "node --test tools/scripts/check-ci-source-immutability.test.mjs: 12/12 pass",
      "pnpm run guard:governance-schema exits 0",
      "pnpm run guard:workflow-lint (actionlint) exits 0",
      "pnpm run guard:actions-pin exits 0"
    ],
    "forbiddenChanges": [
      "Touching any CORE workflow (ci.yml, ci-*.yml, dsh-database.yml, jrn-020-025-sambassam-verify.yml, lockfile-snapshot.yml).",
      "Adding contents:write or any privileged permission.",
      "Adding a repository secret reference to remediation-analysis.yml."
    ],
    "workUnitIds": [],
    "budget": {
      "maxAgentIterations": 3
    }
  },
  "execution": {
    "agentRole": "CI_GOVERNANCE_EXECUTOR",
    "capabilityTier": "T1_BALANCED",
    "changedPaths": [
      ".github/workflows/remediation-analysis.yml",
      "tools/guards/required-command-integrity-gate.mjs",
      "tools/scripts/check-ci-source-immutability.mjs",
      "tools/scripts/check-ci-source-immutability.test.mjs",
      "governance/github/workflow-registry.json",
      "docs/ci-governance-required-checks.md"
    ],
    "patchHash": "sha256:7d5d359fed9752b19b16940b32b01cc3e3b169e3f84533e04f0274a7a7fd0ad2"
  },
  "observation": {
    "checks": [
      {
        "command": "node tools/guards/required-command-integrity-gate.mjs",
        "before": "PASS",
        "after": "PASS",
        "exitCode": 0,
        "evidenceRef": ".diagnostics/remediation/evidence/GAP-0002/static-results.txt",
        "evidenceSha256": "sha256:677590998f9ae5650da787f7353356528082f56bfc0cb5e8f5851ef5ffd0c538"
      },
      {
        "command": "node tools/guards/guard-registry-gate.mjs",
        "before": "PASS",
        "after": "PASS",
        "exitCode": 0,
        "evidenceRef": ".diagnostics/remediation/evidence/GAP-0002/static-results.txt",
        "evidenceSha256": "sha256:677590998f9ae5650da787f7353356528082f56bfc0cb5e8f5851ef5ffd0c538"
      },
      {
        "command": "node --test tools/scripts/check-ci-source-immutability.test.mjs",
        "before": "PASS",
        "after": "PASS",
        "exitCode": 0,
        "evidenceRef": ".diagnostics/remediation/evidence/GAP-0002/static-results.txt",
        "evidenceSha256": "sha256:677590998f9ae5650da787f7353356528082f56bfc0cb5e8f5851ef5ffd0c538"
      },
      {
        "command": "pnpm run guard:governance-schema",
        "before": "PASS",
        "after": "PASS",
        "exitCode": 0,
        "evidenceRef": ".diagnostics/remediation/evidence/GAP-0002/static-results.txt",
        "evidenceSha256": "sha256:677590998f9ae5650da787f7353356528082f56bfc0cb5e8f5851ef5ffd0c538"
      }
    ],
    "unexpectedResults": [
      "governance/cleanup/repository-retention-policy.json and governance/github/remediation-branch-return-policy.json were listed as target files in the original GAP-0002 ledger entry but, on inspection, reference remediation-analysis.yml only by file path (never by name string or step marker), so no edit was required in either; recorded here rather than force-editing them to match a stale nine-file assumption.",
      "guard:workflow-security (zizmor) could not run in this local sandbox because Python is unavailable (Microsoft Store execution-alias stub); this is a pre-existing local-environment limitation unrelated to this change, not a regression it introduced. guard:workflow-lint (actionlint) and guard:actions-pin, which do not depend on Python, both passed against the modernized workflow."
    ]
  },
  "evaluation": {
    "acceptanceDelta": 3,
    "failedGatesBefore": 0,
    "failedGatesAfter": 0,
    "regressionCount": 0,
    "scopeViolationCount": 0,
    "unexpectedDeletionCount": 0,
    "convergence": "IMPROVING"
  },
  "diagnosis": {
    "hypothesisConfirmed": true,
    "newFindings": [
      "The three consuming guards (required-command-integrity-gate.mjs, guard-registry-gate.mjs, check-ci-source-immutability.mjs) key off two different identifiers for remediation-analysis.yml: guard-registry-gate.mjs matches purely by file path, so it needed no edit; the other two match by literal name/step-title strings inside the file content, so both needed synchronized marker updates."
    ],
    "rootCauseState": "CONFIRMED"
  },
  "improve": {
    "missingGuards": [],
    "regressionTestsNeeded": [],
    "reusableRepairScripts": [],
    "blindSpotsFound": [
      "guard:workflow-security (zizmor) has a hard Python-availability dependency that is not satisfiable in this local Windows sandbox; CI itself installs Python so this is not a gap in enforcement, only a local verification blind spot worth noting for future sessions on this machine."
    ]
  },
  "decision": {
    "status": "PASS"
  },
  "antiThrash": {
    "priorHypothesisHashes": [],
    "priorPatchHashes": [],
    "priorFailureFingerprints": [
      "WORKFLOW_MODERNIZATION_REQUIRED:remediation-analysis.yml"
    ]
  }
}
